{
  "$schema": "http://json-schema.org/draft-07/schema#",
  "$id": "https://github.com/bschonbrun/claude-code-stack/schemas/stack-config-schema.json",
  "title": "Stack Project Configuration",
  "description": "Per-project configuration for Claude Code Stack. Lives at <project>/.claude/stack-config.json. Created by /project-init, edited by /default-edit project and shortcut skills.",
  "type": "object",
  "required": ["stack_version", "stack_tier", "purpose", "created"],
  "properties": {
    "stack_version": {
      "type": "string",
      "pattern": "^\\d+\\.\\d+\\.\\d+$",
      "description": "Semantic version of the stack this config was created against."
    },
    "stack_tier": {
      "type": "integer",
      "minimum": 0,
      "maximum": 5,
      "description": "Active stack tier (0=Foundation through 5=Local+Offline)."
    },
    "purpose": {
      "type": "string",
      "description": "One-line description of what this project is for."
    },
    "created": { "type": "string", "format": "date" },
    "last_modified": { "type": "string", "format": "date" },
    "orchestration_mode": {
      "type": "string",
      "enum": ["main-thread", "agent-teams", "hybrid", "dynamic-workflows"],
      "default": "main-thread",
      "description": "v1.1: How foreman dispatches subagents. main-thread is trusted default; agent-teams uses Anthropic's experimental Agent Teams; hybrid mixes (main-thread critical path + parallel review/audit via teams); dynamic-workflows uses Opus 4.8's research-preview workflow runtime for read-only fan-out, gated behind /cost-gate (v1.2)."
    },
    "strict_mode": {
      "type": "boolean",
      "default": true,
      "description": "If true, foreman refuses to dispatch in projects without stack-config.json."
    },
    "domain_mode": {
      "type": ["string", "null"],
      "enum": ["financial-code", "schema-migration", "deploy", "ui-design", "data-operation", null],
      "description": "Activates extra safety rules in foreman. null means no special mode."
    },
    "sensitivity": {
      "type": "object",
      "properties": {
        "level": {
          "type": "string",
          "enum": ["normal", "sensitive", "confidential"],
          "default": "normal"
        },
        "notes": { "type": "string" }
      },
      "required": ["level"]
    },
    "active_subagents": {
      "type": "array",
      "items": { "type": "string" },
      "description": "Subagents enabled for this project. Empty array means use tier defaults."
    },
    "required_approvals": {
      "type": "array",
      "items": {
        "type": "string",
        "enum": ["pre-merge", "pre-deploy", "pre-schema-change", "pre-bulk-job"]
      }
    },
    "model_overrides": {
      "type": "object",
      "description": "Per-subagent model overrides. Keys are subagent names; values are model identifiers from model-routing.json.",
      "additionalProperties": { "type": "string" }
    },
    "skill_overrides": {
      "type": "object",
      "description": "Per-skill behavioral overrides.",
      "additionalProperties": true
    },
    "review": {
      "type": "object",
      "description": "ADR-030: adversarial-review transport settings (Tier 2+). Read by scripts/lib/openai-review.sh.",
      "properties": {
        "codex_transport": {
          "type": "string",
          "enum": ["api", "cli"],
          "default": "api",
          "description": "How the OpenAI/GPT-5.5 review family is reached: 'api' (default — OpenAI API via oair_call) or 'cli' (codex exec with automatic API fallback). Precedence: env REVIEW_CODEX_TRANSPORT > this > default 'api'."
        }
      },
      "additionalProperties": false
    },
    "cost_protection": {
      "type": "object",
      "properties": {
        "per_session_alert_usd": { "type": ["number", "null"], "minimum": 0 },
        "per_day_alert_usd": { "type": ["number", "null"], "minimum": 0 },
        "per_session_hard_cap_usd": { "type": ["number", "null"], "minimum": 0 }
      }
    },
    "brevity": {
      "type": "object",
      "description": "v1.2: Per-project tuning for the brevity-drift UserPromptSubmit hook (hooks/brevity-drift.sh). Absent -> the hook uses its built-in defaults (enabled, 120 words / 6 sentences). Any field missing or non-numeric falls back to that default.",
      "properties": {
        "enabled": {
          "type": "boolean",
          "default": true,
          "description": "If false, the brevity-drift hook stays silent for this project (e.g. docs- or prose-heavy repos)."
        },
        "word_budget": {
          "type": "integer",
          "minimum": 1,
          "default": 120,
          "description": "Word count above which the assistant's last response triggers a brevity correction."
        },
        "sentence_budget": {
          "type": "integer",
          "minimum": 1,
          "default": 6,
          "description": "Sentence count above which the assistant's last response triggers a brevity correction."
        }
      },
      "additionalProperties": false
    },
    "session_prefs": {
      "type": "object",
      "description": "v1.2: Project-level default session preferences offered by /session, /goodmorning, /project-init. Live session overrides are written to ~/.claude/session-state/current-prefs.json; this block is the project fallback. Precedence: session-state > this > stack-defaults.session_prefs_defaults > built-in.",
      "properties": {
        "communication_style": { "type": "string", "enum": ["terse", "balanced", "thorough"], "default": "balanced", "description": "Maps to the brevity-drift word/sentence budgets." },
        "model_effort": { "type": "string", "enum": ["minimal", "fast", "balanced", "thorough", "max"], "default": "balanced", "description": "Opus 4.8 effort preference for the session (5-point, ADR-022). Legacy fast/balanced/max remain valid (subset)." },
        "explanation_verbosity": { "type": "string", "enum": ["minimal", "normal", "teaching"], "default": "normal" },
        "orchestration_mode": { "type": "string", "enum": ["main-thread", "agent-teams", "hybrid", "dynamic-workflows"], "description": "Session orchestration override; falls back to top-level orchestration_mode if unset." },
        "cost_alert_sensitivity": { "type": "string", "enum": ["relaxed", "normal", "strict"], "default": "normal" },
        "passive_suggest": { "type": "boolean", "default": true, "description": "When true, dispatch-nudge.sh appends a pointer to the recommend-capabilities engine. Set to false to silence the recommender pointer while keeping the /foreman//dispatch routing nudge." },
        "simple_talk": { "type": "string", "enum": ["off", "plain", "caveman"], "default": "off", "description": "v1.3 (ADR-032): plainness/wording modifier, orthogonal to communication_style (which sets length). off = no change; plain = plain words, no jargon; caveman = terse caveman phrasing. Injected each turn by hooks/simple-talk.sh." }
      },
      "additionalProperties": false
    },
    "loop_policy": {
      "type": "object",
      "additionalProperties": false,
      "description": "Governance for autonomous loops (ADR-019). Defaults ship safe; tier raises the ceiling.",
      "properties": {
        "enabled": { "type": "boolean", "default": true },
        "default_autonomy": { "type": "string", "enum": ["checkpoint", "bounded-checkpoint", "bounded-autonomous"], "default": "checkpoint" },
        "autonomy_ceiling": { "type": "string", "enum": ["checkpoint", "bounded-checkpoint", "bounded-autonomous"], "default": "checkpoint" },
        "max_iterations": { "type": "integer", "minimum": 1, "default": 25 },
        "max_recursion_depth": { "type": "integer", "minimum": 1, "default": 5, "description": "ADVISORY in Phase 1: the runtime does not enforce fan-out/recursion depth; max_iterations is the hard cap. Phase 2 will enforce this." },
        "per_run_budget_usd": { "type": ["number", "null"], "default": 5, "description": "Between-iteration advisory cap in Phase 1: cost is accrued from subagent-runs.jsonl at each Stop-hook invocation and compared before the next iteration. Does NOT stop a within-iteration runaway (Phase 2 live monitor closes that gap)." },
        "timeout_minutes": { "type": ["integer", "null"], "default": 180 },
        "no_progress_exit": { "type": "boolean", "default": true },
        "require_external_termination": { "type": "string", "enum": ["auto", "always", "never"], "default": "auto" },
        "commit_per_iteration": { "type": "boolean", "default": false },
        "irreversible_actions_break_loop": { "type": "boolean", "default": true }
      }
    },
    "workflow_roster": {
      "type": "string",
      "enum": ["warn", "block", "off"],
      "default": "warn",
      "description": "v1.2: Controls hooks/workflow-roster-check.sh. 'warn' (default): write-heavy Workflow runs naming no roster agentType emit a non-blocking system-reminder. 'block': such runs are denied (permissionDecision:deny). 'off': no warn/deny, but the run is still logged. Absent or invalid -> 'warn'. No auto-escalation from strict_mode/sensitivity (ADR-016)."
    },
    "change_history": {
      "type": "array",
      "items": {
        "type": "object",
        "required": ["date", "setting", "old_value", "new_value", "reason", "scope", "invoked_via"],
        "properties": {
          "date": { "type": "string", "format": "date-time" },
          "setting": { "type": "string", "description": "Dot-path of changed setting" },
          "old_value": {},
          "new_value": {},
          "reason": { "type": "string" },
          "scope": { "type": "string", "enum": ["project", "global"] },
          "also_updated_global": { "type": "boolean" },
          "invoked_via": { "type": "string" }
        }
      }
    }
  },
  "additionalProperties": false
}
