{
  "stack_version": "1.1.3",
  "stack_tier": 4,
  "purpose": "The Claude Code Stack source repo — dogfooding the tiered multi-agent config on itself.",
  "created": "2026-06-18",
  "last_modified": "2026-06-20",
  "orchestration_mode": "main-thread",
  "strict_mode": false,
  "domain_mode": null,
  "sensitivity": {
    "level": "normal",
    "notes": "Public repo; no secrets tracked."
  },
  "active_subagents": [
    "architect",
    "implementer",
    "validator",
    "reviewer",
    "tester",
    "red-team",
    "security-auditor",
    "product-critic",
    "designer",
    "documenter",
    "ops",
    "scribe",
    "foreman-team-lead",
    "performance-engineer",
    "data-engineer",
    "integration-specialist",
    "incident-commander",
    "architecture-critic",
    "accessibility-auditor",
    "historian",
    "librarian",
    "estimator"
  ],
  "required_approvals": [],
  "model_overrides": {},
  "skill_overrides": {},
  "cost_protection": {
    "per_session_alert_usd": 5.00,
    "per_day_alert_usd": 50.00,
    "per_session_hard_cap_usd": null
  },
  "change_history": [
    {
      "date": "2026-06-18T15:51:54Z",
      "setting": "init",
      "old_value": null,
      "new_value": "tier 2",
      "reason": "init — dogfood Tier 2 roster + workflow-roster hook on the source repo",
      "scope": "project",
      "also_updated_global": false,
      "invoked_via": "/project-init"
    },
    {
      "date": "2026-06-19T00:00:00Z",
      "setting": "tier",
      "old_value": "tier 2",
      "new_value": "tier 4",
      "reason": "enable full specialist + meta team for the 3-feature Tier-4 planning work (architect/critics/historian)",
      "scope": "project",
      "also_updated_global": true,
      "invoked_via": "/tier"
    },
    {
      "date": "2026-06-20T23:01:17Z",
      "setting": "loop_policy",
      "old_value": null,
      "new_value": "default block (backfill)",
      "reason": "backfill: loop governor made core scaffolding (Tier 2+)",
      "scope": "project",
      "also_updated_global": false,
      "invoked_via": "script:backfill-loop-policy.sh"
    }
  ],
  "loop_policy": {
    "enabled": true,
    "default_autonomy": "checkpoint",
    "autonomy_ceiling": "checkpoint",
    "max_iterations": 25,
    "max_recursion_depth": 5,
    "per_run_budget_usd": 5,
    "timeout_minutes": 180,
    "no_progress_exit": true,
    "require_external_termination": "auto",
    "commit_per_iteration": false,
    "irreversible_actions_break_loop": true
  }
}
